{
  "date_kst": "2026.10.24",
  "us_game_date": "2026.10.23",
  "timestamp": "auto",
  "disclaimer": "",
  "data_source": "경기 데이터 · Sportradar",
  "cover": {
    "mode": "game_day",
    "headline": "47점 차,\n호크스의 새 역사"
  },
  "games": [
    {
      "away": {
        "abbr": "CHI",
        "score": 132
      },
      "home": {
        "abbr": "MIL",
        "score": 125
      },
      "ot": 0
    },
    {
      "away": {
        "abbr": "ATL",
        "score": 128
      },
      "home": {
        "abbr": "CHA",
        "score": 81
      },
      "ot": 0
    },
    {
      "away": {
        "abbr": "NYK",
        "score": 103
      },
      "home": {
        "abbr": "BOS",
        "score": 107
      },
      "ot": 0
    },
    {
      "away": {
        "abbr": "TOR",
        "score": 112
      },
      "home": {
        "abbr": "WAS",
        "score": 102
      },
      "ot": 0
    },
    {
      "away": {
        "abbr": "MIN",
        "score": 115
      },
      "home": {
        "abbr": "ORL",
        "score": 93
      },
      "ot": 0
    },
    {
      "away": {
        "abbr": "DAL",
        "score": 121
      },
      "home": {
        "abbr": "IND",
        "score": 105
      },
      "ot": 0
    },
    {
      "away": {
        "abbr": "DET",
        "score": 128
      },
      "home": {
        "abbr": "MIA",
        "score": 111
      },
      "ot": 0
    },
    {
      "away": {
        "abbr": "HOU",
        "score": 114
      },
      "home": {
        "abbr": "SAS",
        "score": 110
      },
      "ot": 0
    },
    {
      "away": {
        "abbr": "NOP",
        "score": 119
      },
      "home": {
        "abbr": "UTA",
        "score": 120
      },
      "ot": 0
    },
    {
      "away": {
        "abbr": "LAC",
        "score": 117
      },
      "home": {
        "abbr": "LAL",
        "score": 125
      },
      "ot": 0
    },
    {
      "away": {
        "abbr": "MEM",
        "score": 111
      },
      "home": {
        "abbr": "GSW",
        "score": 108
      },
      "ot": 0
    },
    {
      "away": {
        "abbr": "POR",
        "score": 128
      },
      "home": {
        "abbr": "SAC",
        "score": 120
      },
      "ot": 0
    }
  ],
  "featured": [
    {
      "away": "ATL",
      "home": "CHA",
      "label": "47점 차 · 구단 최다 승리",
      "headline": "전반 25점 차로 끝낸 승부",
      "away_leader": {
        "name": "제일런 존슨",
        "pts": 19,
        "reb": 7,
        "ast": 8
      },
      "home_leader": {
        "name": "나즈 리드",
        "pts": 17,
        "reb": 6,
        "ast": 2
      }
    },
    {
      "away": "HOU",
      "home": "SAS",
      "headline": "종료 직전 블록이 지킨 승리",
      "away_leader": {
        "name": "알페렌 셍귄",
        "pts": 29,
        "reb": 7,
        "ast": 7
      },
      "home_leader": {
        "name": "빅터 웸반야마",
        "pts": 25,
        "reb": 13,
        "ast": 2
      }
    }
  ],
  "news": [
    {
      "status": "부상 업데이트",
      "verification": "감독 발언 · 정밀 진단 전",
      "title": "쿠퍼 플래그,\n왼쪽 어깨 부상",
      "body": "인디애나전 전반 막판 플래그런트 파울을 당한 뒤\n돌아오지 못했다. 댈러스는 며칠간 상태를 지켜본다.",
      "source": "CBS Sports · AP",
      "teams": [
        "DAL"
      ]
    },
    {
      "status": "부상 업데이트",
      "verification": "복귀 일정 미정",
      "title": "피스톤스,\n듀런·어사 톰슨 이탈",
      "body": "마이애미전에서 듀런은 오른쪽 허벅지, 톰슨은\n오른쪽 발목을 다쳐 코트로 돌아오지 못했다.",
      "source": "Yahoo Sports",
      "teams": [
        "DET"
      ]
    }
  ],
  "standings": {
    "note": "리그 공식 순위",
    "east": [
      {
        "rank": 1,
        "abbr": "ATL",
        "w": 2,
        "l": 0
      },
      {
        "rank": 2,
        "abbr": "DET",
        "w": 2,
        "l": 0
      },
      {
        "rank": 3,
        "abbr": "PHI",
        "w": 2,
        "l": 0
      },
      {
        "rank": 4,
        "abbr": "TOR",
        "w": 2,
        "l": 0
      },
      {
        "rank": 5,
        "abbr": "WAS",
        "w": 1,
        "l": 1
      },
      {
        "rank": 6,
        "abbr": "BOS",
        "w": 1,
        "l": 1
      },
      {
        "rank": 7,
        "abbr": "CHI",
        "w": 1,
        "l": 1
      },
      {
        "rank": 8,
        "abbr": "CHA",
        "w": 1,
        "l": 1
      },
      {
        "rank": 9,
        "abbr": "IND",
        "w": 1,
        "l": 1
      },
      {
        "rank": 10,
        "abbr": "BKN",
        "w": 0,
        "l": 1
      },
      {
        "rank": 11,
        "abbr": "CLE",
        "w": 0,
        "l": 1
      },
      {
        "rank": 12,
        "abbr": "ORL",
        "w": 0,
        "l": 2
      },
      {
        "rank": 13,
        "abbr": "MIA",
        "w": 0,
        "l": 2
      },
      {
        "rank": 14,
        "abbr": "NYK",
        "w": 0,
        "l": 2
      },
      {
        "rank": 15,
        "abbr": "MIL",
        "w": 0,
        "l": 2
      }
    ],
    "west": [
      {
        "rank": 1,
        "abbr": "LAL",
        "w": 2,
        "l": 0
      },
      {
        "rank": 2,
        "abbr": "OKC",
        "w": 2,
        "l": 0
      },
      {
        "rank": 3,
        "abbr": "HOU",
        "w": 2,
        "l": 0
      },
      {
        "rank": 4,
        "abbr": "POR",
        "w": 2,
        "l": 0
      },
      {
        "rank": 5,
        "abbr": "MEM",
        "w": 2,
        "l": 0
      },
      {
        "rank": 6,
        "abbr": "MIN",
        "w": 2,
        "l": 0
      },
      {
        "rank": 7,
        "abbr": "LAC",
        "w": 1,
        "l": 1
      },
      {
        "rank": 8,
        "abbr": "UTA",
        "w": 1,
        "l": 1
      },
      {
        "rank": 9,
        "abbr": "DAL",
        "w": 1,
        "l": 1
      },
      {
        "rank": 10,
        "abbr": "DEN",
        "w": 0,
        "l": 1
      },
      {
        "rank": 11,
        "abbr": "PHX",
        "w": 0,
        "l": 1
      },
      {
        "rank": 12,
        "abbr": "NOP",
        "w": 0,
        "l": 2
      },
      {
        "rank": 13,
        "abbr": "SAS",
        "w": 0,
        "l": 2
      },
      {
        "rank": 14,
        "abbr": "GSW",
        "w": 0,
        "l": 2
      },
      {
        "rank": 15,
        "abbr": "SAC",
        "w": 0,
        "l": 2
      }
    ]
  },
  "closing": {
    "title": "내일도,\n코티브에서.",
    "follow_cta": "팔로우로 매일 NBA 브리핑 받기",
    "save_cta": "오늘의 브리핑은 저장해 두세요.",
    "references": "경기·순위 · Sportradar 경기 데이터\n뉴스 · CBS Sports, Yahoo Sports(AP)"
  }
}