{
  "date_kst": "2026.10.26",
  "us_game_date": "2026.10.25",
  "timestamp": "auto",
  "disclaimer": "",
  "data_source": "경기 데이터 · CBS Sports",
  "cover": {
    "mode": "game_day",
    "headline": "18점 차 역전\n돈치치 *52점*",
    "focus": {
      "type": "player",
      "name": "루카 돈치치",
      "team": "LAL",
      "game": 0,
      "stats": [
        {
          "v": "52",
          "k": "득점"
        },
        {
          "v": "8",
          "k": "리바운드"
        },
        {
          "v": "10",
          "k": "어시스트"
        }
      ]
    }
  },
  "games": [
    {
      "away": {
        "abbr": "LAL",
        "score": 132
      },
      "home": {
        "abbr": "UTA",
        "score": 123
      },
      "ot": 0
    },
    {
      "away": {
        "abbr": "IND",
        "score": 136
      },
      "home": {
        "abbr": "BKN",
        "score": 109
      },
      "ot": 0
    },
    {
      "away": {
        "abbr": "LAC",
        "score": 101
      },
      "home": {
        "abbr": "OKC",
        "score": 108
      },
      "ot": 0
    },
    {
      "away": {
        "abbr": "ORL",
        "score": 111
      },
      "home": {
        "abbr": "NYK",
        "score": 102
      },
      "ot": 0
    },
    {
      "away": {
        "abbr": "TOR",
        "score": 94
      },
      "home": {
        "abbr": "MIN",
        "score": 117
      },
      "ot": 0
    },
    {
      "away": {
        "abbr": "DET",
        "score": 106
      },
      "home": {
        "abbr": "PHI",
        "score": 93
      },
      "ot": 0
    },
    {
      "away": {
        "abbr": "MEM",
        "score": 123
      },
      "home": {
        "abbr": "SAC",
        "score": 112
      },
      "ot": 0
    }
  ],
  "featured": [
    {
      "away": "LAL",
      "home": "UTA",
      "max_deficit_overcome": 18,
      "label": "18점 차 역전 · 3연승",
      "headline": "돈치치 52점 3점슛 8개",
      "away_leader": {
        "name": "루카 돈치치",
        "pts": 52,
        "reb": 8,
        "ast": 10
      },
      "home_leader": {
        "name": "라우리 마카넨",
        "pts": 28,
        "reb": 6,
        "ast": 1
      }
    },
    {
      "away": "ORL",
      "home": "NYK",
      "label": "4쿼터 역전 · 닉스 0-3",
      "headline": "매직 역전승 챔피언 닉스 0-3",
      "away_leader": {
        "name": "프란츠 바그너",
        "pts": 23,
        "reb": 13,
        "ast": 9
      },
      "home_leader": {
        "name": "제일런 브런슨",
        "pts": 28,
        "reb": 3,
        "ast": 4
      }
    },
    {
      "away": "DET",
      "home": "PHI",
      "label": "무패 맞대결",
      "headline": "커닝햄 26점 디트로이트 3연승",
      "away_leader": {
        "name": "케이드 커닝햄",
        "pts": 26,
        "reb": 8,
        "ast": 8
      },
      "home_leader": {
        "name": "타이리스 맥시",
        "pts": 29,
        "reb": 5,
        "ast": 4
      }
    }
  ],
  "news": [
    {
      "status": "부상 업데이트",
      "verification": "진단 결과 발표 전",
      "teams": [
        "OKC"
      ],
      "title": "제일런 윌리엄스\n들것에 실려 퇴장",
      "body": "클리퍼스전 막판 왼쪽 다리를 다쳤다\n월리스·제일린 윌리엄스도 부상으로 빠졌다",
      "source": "Yahoo Sports · Field Level Media",
      "key": {
        "value": "3",
        "unit": "명",
        "label": "이날 썬더 부상자"
      }
    },
    {
      "status": "부상 업데이트",
      "verification": "왼쪽 무릎 부기 · 복귀 미정",
      "teams": [
        "TOR"
      ],
      "title": "카와이 레너드\n경기 직전 결장",
      "body": "토론토 복귀 후 벌써 세 번째 결장이다\n랩터스는 미네소타에 94-117로 졌다",
      "source": "Yahoo Sports",
      "key": {
        "value": "3",
        "unit": "번째",
        "label": "이번 시즌 결장"
      }
    },
    {
      "status": "부상 업데이트",
      "verification": "아킬레스 파열 뒤 복귀 시즌",
      "teams": [
        "IND"
      ],
      "title": "할리버튼\n복귀 후 최고의 밤",
      "body": "브루클린전 24점 10어시스트 3점슛 4/7\n후반에만 20점을 넣었다",
      "source": "Field Level Media",
      "key": {
        "value": "24",
        "unit": "점",
        "label": "10어시스트 · 복귀 후 최고"
      }
    }
  ],
  "standings": {
    "note": "승률순 · 동률 순서 잠정",
    "east": [
      {
        "rank": 1,
        "abbr": "DET",
        "w": 3,
        "l": 0
      },
      {
        "rank": 2,
        "abbr": "PHI",
        "w": 3,
        "l": 1
      },
      {
        "rank": 3,
        "abbr": "TOR",
        "w": 2,
        "l": 1
      },
      {
        "rank": 4,
        "abbr": "ATL",
        "w": 2,
        "l": 1
      },
      {
        "rank": 5,
        "abbr": "CHA",
        "w": 2,
        "l": 1
      },
      {
        "rank": 6,
        "abbr": "WAS",
        "w": 2,
        "l": 1
      },
      {
        "rank": 7,
        "abbr": "IND",
        "w": 2,
        "l": 1
      },
      {
        "rank": 8,
        "abbr": "BOS",
        "w": 1,
        "l": 1
      },
      {
        "rank": 9,
        "abbr": "CLE",
        "w": 1,
        "l": 1
      },
      {
        "rank": 10,
        "abbr": "CHI",
        "w": 1,
        "l": 2
      },
      {
        "rank": 11,
        "abbr": "ORL",
        "w": 1,
        "l": 2
      },
      {
        "rank": 12,
        "abbr": "NYK",
        "w": 0,
        "l": 3
      },
      {
        "rank": 13,
        "abbr": "BKN",
        "w": 0,
        "l": 3
      },
      {
        "rank": 14,
        "abbr": "MIA",
        "w": 0,
        "l": 3
      },
      {
        "rank": 15,
        "abbr": "MIL",
        "w": 0,
        "l": 3
      }
    ],
    "west": [
      {
        "rank": 1,
        "abbr": "HOU",
        "w": 3,
        "l": 0
      },
      {
        "rank": 2,
        "abbr": "LAL",
        "w": 3,
        "l": 0
      },
      {
        "rank": 3,
        "abbr": "OKC",
        "w": 3,
        "l": 0
      },
      {
        "rank": 4,
        "abbr": "POR",
        "w": 2,
        "l": 0
      },
      {
        "rank": 5,
        "abbr": "MEM",
        "w": 3,
        "l": 0
      },
      {
        "rank": 6,
        "abbr": "MIN",
        "w": 3,
        "l": 0
      },
      {
        "rank": 7,
        "abbr": "DEN",
        "w": 1,
        "l": 1
      },
      {
        "rank": 8,
        "abbr": "PHX",
        "w": 1,
        "l": 1
      },
      {
        "rank": 9,
        "abbr": "LAC",
        "w": 1,
        "l": 2
      },
      {
        "rank": 10,
        "abbr": "UTA",
        "w": 1,
        "l": 2
      },
      {
        "rank": 11,
        "abbr": "SAS",
        "w": 1,
        "l": 2
      },
      {
        "rank": 12,
        "abbr": "DAL",
        "w": 1,
        "l": 2
      },
      {
        "rank": 13,
        "abbr": "SAC",
        "w": 0,
        "l": 3
      },
      {
        "rank": 14,
        "abbr": "NOP",
        "w": 0,
        "l": 3
      },
      {
        "rank": 15,
        "abbr": "GSW",
        "w": 0,
        "l": 3
      }
    ]
  },
  "closing": {
    "title": "NBA 소식은\n코티브에서",
    "follow_cta": "매일 전해주는 NBA 소식",
    "save_cta": "오늘의 브리핑은 저장해 두세요.",
    "references": "경기 · CBS Sports, Field Level Media\n뉴스 · Yahoo Sports, Field Level Media, AP"
  }
}