{
  "date_kst": "2026.10.25",
  "us_game_date": "2026.10.24",
  "timestamp": "auto",
  "disclaimer": "",
  "data_source": "경기 데이터 · Sportradar",
  "cover": {
    "mode": "game_day",
    "headline": "23점 차 대역전,\n요키치 트리플더블"
  },
  "games": [
    {
      "away": {
        "abbr": "MIA",
        "score": 110
      },
      "home": {
        "abbr": "CHA",
        "score": 115
      },
      "ot": 0
    },
    {
      "away": {
        "abbr": "MIL",
        "score": 116
      },
      "home": {
        "abbr": "PHI",
        "score": 127
      },
      "ot": 0
    },
    {
      "away": {
        "abbr": "BKN",
        "score": 121
      },
      "home": {
        "abbr": "CLE",
        "score": 125
      },
      "ot": 0
    },
    {
      "away": {
        "abbr": "SAS",
        "score": 122
      },
      "home": {
        "abbr": "DAL",
        "score": 106
      },
      "ot": 0
    },
    {
      "away": {
        "abbr": "WAS",
        "score": 124
      },
      "home": {
        "abbr": "CHI",
        "score": 120
      },
      "ot": 0
    },
    {
      "away": {
        "abbr": "HOU",
        "score": 121
      },
      "home": {
        "abbr": "ATL",
        "score": 114
      },
      "ot": 0
    },
    {
      "away": {
        "abbr": "NOP",
        "score": 135
      },
      "home": {
        "abbr": "DEN",
        "score": 141
      },
      "ot": 1
    },
    {
      "away": {
        "abbr": "GSW",
        "score": 122
      },
      "home": {
        "abbr": "PHX",
        "score": 131
      },
      "ot": 0
    }
  ],
  "featured": [
    {
      "away": "NOP",
      "home": "DEN",
      "max_deficit_overcome": 23,
      "label": "연장 · 23점 차 역전",
      "headline": "요키치 35-15-10, 대역전승",
      "away_leader": {
        "name": "트레이 머피 3세",
        "pts": 26,
        "reb": 6,
        "ast": 4
      },
      "home_leader": {
        "name": "자말 머레이",
        "pts": 42,
        "reb": 3,
        "ast": 6
      }
    },
    {
      "away": "MIL",
      "home": "PHI",
      "label": "3연승 · 트리플더블",
      "headline": "엠비드 트리플더블로 3연승",
      "away_leader": {
        "name": "하이메 하케스 Jr.",
        "pts": 21,
        "reb": 8,
        "ast": 4
      },
      "home_leader": {
        "name": "조엘 엠비드",
        "pts": 28,
        "reb": 11,
        "ast": 10
      }
    },
    {
      "away": "GSW",
      "home": "PHX",
      "label": "43점 · 워리어스 0-3",
      "headline": "부커 43점, 야투 25개 중 17개",
      "away_leader": {
        "name": "야셀 렌데보그",
        "pts": 26,
        "reb": 9,
        "ast": 5
      },
      "home_leader": {
        "name": "데빈 부커",
        "pts": 43,
        "reb": 7,
        "ast": 7
      }
    }
  ],
  "news": [
    {
      "status": "부상 업데이트",
      "verification": "보도 · 4~6주 이탈 전망",
      "teams": [
        "ORL"
      ],
      "title": "파올로 반케로,\n하이 앵클 스프레인",
      "body": "미네소타전에서 발목을 다쳐 수 주간 결장한다.\n0-2로 출발한 올랜도에 큰 공백이다.",
      "source": "Yahoo Sports · ESPN 보도",
      "key": {
        "value": "4–6",
        "unit": "주",
        "label": "예상 결장 기간 · 보도"
      }
    }
  ],
  "standings": {
    "note": "리그 공식 순위",
    "east": [
      {
        "rank": 1,
        "abbr": "PHI",
        "w": 3,
        "l": 0
      },
      {
        "rank": 2,
        "abbr": "DET",
        "w": 2,
        "l": 0
      },
      {
        "rank": 3,
        "abbr": "TOR",
        "w": 2,
        "l": 0
      },
      {
        "rank": 4,
        "abbr": "ATL",
        "w": 2,
        "l": 1
      },
      {
        "rank": 5,
        "abbr": "CHA",
        "w": 2,
        "l": 1
      },
      {
        "rank": 6,
        "abbr": "WAS",
        "w": 2,
        "l": 1
      },
      {
        "rank": 7,
        "abbr": "BOS",
        "w": 1,
        "l": 1
      },
      {
        "rank": 8,
        "abbr": "CLE",
        "w": 1,
        "l": 1
      },
      {
        "rank": 9,
        "abbr": "IND",
        "w": 1,
        "l": 1
      },
      {
        "rank": 10,
        "abbr": "CHI",
        "w": 1,
        "l": 2
      },
      {
        "rank": 11,
        "abbr": "ORL",
        "w": 0,
        "l": 2
      },
      {
        "rank": 12,
        "abbr": "NYK",
        "w": 0,
        "l": 2
      },
      {
        "rank": 13,
        "abbr": "BKN",
        "w": 0,
        "l": 2
      },
      {
        "rank": 14,
        "abbr": "MIA",
        "w": 0,
        "l": 3
      },
      {
        "rank": 15,
        "abbr": "MIL",
        "w": 0,
        "l": 3
      }
    ],
    "west": [
      {
        "rank": 1,
        "abbr": "HOU",
        "w": 3,
        "l": 0
      },
      {
        "rank": 2,
        "abbr": "LAL",
        "w": 2,
        "l": 0
      },
      {
        "rank": 3,
        "abbr": "OKC",
        "w": 2,
        "l": 0
      },
      {
        "rank": 4,
        "abbr": "POR",
        "w": 2,
        "l": 0
      },
      {
        "rank": 5,
        "abbr": "MEM",
        "w": 2,
        "l": 0
      },
      {
        "rank": 6,
        "abbr": "MIN",
        "w": 2,
        "l": 0
      },
      {
        "rank": 7,
        "abbr": "LAC",
        "w": 1,
        "l": 1
      },
      {
        "rank": 8,
        "abbr": "DEN",
        "w": 1,
        "l": 1
      },
      {
        "rank": 9,
        "abbr": "UTA",
        "w": 1,
        "l": 1
      },
      {
        "rank": 10,
        "abbr": "PHX",
        "w": 1,
        "l": 1
      },
      {
        "rank": 11,
        "abbr": "SAS",
        "w": 1,
        "l": 2
      },
      {
        "rank": 12,
        "abbr": "DAL",
        "w": 1,
        "l": 2
      },
      {
        "rank": 13,
        "abbr": "SAC",
        "w": 0,
        "l": 2
      },
      {
        "rank": 14,
        "abbr": "NOP",
        "w": 0,
        "l": 3
      },
      {
        "rank": 15,
        "abbr": "GSW",
        "w": 0,
        "l": 3
      }
    ]
  },
  "closing": {
    "title": "NBA 소식은\n코티브에서",
    "follow_cta": "매일 전해주는 NBA 소식",
    "save_cta": "오늘의 브리핑은 저장해 두세요.",
    "references": "경기·순위 · Sportradar 경기 데이터\n뉴스 · AP, Yahoo Sports, ESPN"
  }
}